{
  "schema_version": "1",
  "version": "go-2026.08.15",
  "name": "Go backend builtin question bank",
  "source": "data/questions/go_interview/go_interview.md",
  "questions": [
    {
      "id": "go-001",
      "type": "basic",
      "topic": "基础面试题",
      "text": "与其他语言相比，使用 Go 有什么好处?",
      "answer": "* 与其他语言不同，Go 代码的设计是务实的，Go的语法更简洁。每个功能和语法决策都旨在让程序员的开发效率更高\n\n* Golang 针对并发进行了优化，支持协程，并且实现了高效的GMP调度模型。\n\n* 由于单一的标准代码格式，Golang 通常被认为比其他语言更具可读性。\n\n* 有高效的垃圾回收机制，支持并行垃圾回收，垃圾回收效率比比 Java 或 Python 更高",
      "source": "data/questions/go_interview/go_interview.md#go-001"
    },
    {
      "id": "go-002",
      "type": "basic",
      "topic": "基础面试题",
      "text": "什么是协程？",
      "answer": "协程是用户态轻量级线程，它是线程调度的基本单位。通常在函数前加上go关键字就能实现并发。一个Goroutine会以一个很小的栈启动2KB或4KB，当遇到栈空间不足时，栈会自动伸缩， 因此可以轻易实现成千上万个goroutine同时启动。",
      "source": "data/questions/go_interview/go_interview.md#go-002"
    },
    {
      "id": "go-003",
      "type": "basic",
      "topic": "基础面试题",
      "text": "协程和线程和进程的区别？",
      "answer": "* 进程:进程是具有一定独立功能的程序，进程是系统资源分配和调度的最小单位。 每个进程都有自己的独立内存空间，不同进程通过进程间通信来通信。由于进程比较重量，占据独立的内存，所以上下文进程间的切换开销（栈、寄存器、虚拟内存、文件句柄等）比较大，但相对比较稳定安全。\n\n* 线程:线程是进程的一个实体,线程是内核态,而且是 CPU 调度和分派的基本单位,它是比进程更小的能独立运行的基本单位。线程间通信主要通过共享内存，上下文切换很快，资源开销较少，但相比进程不够稳定容易丢失数据。\n\n* 协程:协程是一种用户态的轻量级线程，协程的调度完全是由用户来控制的。协程拥有自己的寄存器上下文和栈。 协程调度切换时，将寄存器上下文和栈保存到其他地方，在切回来的时候，恢复先前保存的寄存器上下文和栈，直接操作栈则基本没有内核切换的开销，可以不加锁的访问全局变量，所以上下文的切换非常快。",
      "source": "data/questions/go_interview/go_interview.md#go-003"
    },
    {
      "id": "go-004",
      "type": "basic",
      "topic": "基础面试题",
      "text": "Golang 中 make 和 new 的区别？",
      "answer": "**回答：**\n\n`make` 和 `new` 都是用于内存分配的内建函数，但它们的使用场景和功能有所不同：\n\n1. **`make`**：\n\n   * 用于初始化并分配内存，只能用于创建 `slice`、`map` 和 `channel` 三种类型。\n\n   * 返回的是初始化后的数据结构，而不是指针。\n\n2. **`new`**：\n\n   * 用于分配内存，但不初始化，返回的是指向该内存的指针。\n\n   * 可以用于任何类型的内存分配。\n\n**分析：**\n\n```go\n// 使用 make 创建 slice\ns := make([]int, 5) // 创建一个长度为 5 的 slice\nfmt.Println(s)      // 输出: [0 0 0 0 0]// 使用 new 创建 int 指针\np := new(int)       // 分配内存给 int 类型\nfmt.Println(*p)     // 输出: 0 (初始值)\n```\n\n`make` 函数创建的是数据结构（`slice`、`map`、`channel`）本身，且返回初始化后的值。而`new` 函数创建的是可以指向任意类型的指针，返回指向未初始化零值的内存地址。",
      "source": "data/questions/go_interview/go_interview.md#go-004"
    },
    {
      "id": "go-005",
      "type": "basic",
      "topic": "基础面试题",
      "text": "Golang 中数组和切片的区别？",
      "answer": "**数组: **\n\n数组固定长度。数组长度是数组类型的一部分，所以[3]int 和[4]int 是两种不 同的数组类型数组需要指定大小，不指定也会根据初始化，自动推算出大小， 大小不可改变。数组是通过值传递的\n**切片: **\n\n切片可以改变长度。切片是轻量级的数据结构，三个属性，指针，长度，容量 不需要指定大小切片是地址传递(引用传递)可以通过数组来初始化，也可以通过内置函数 make()来初始化，初始化的时候 len=cap，然后进行扩容\n\n**分析：**\n\nslice 的底层数据其实也是数组，slice 是对数组的封装，它描述一个数组的片段。slice 实际上是一个结构体，包含三个字段：长度、容量、底层数组。\n\n```go\n// runtime/slice.go\ntype slice struct {\n        array unsafe.Pointer // 元素指针\n        len   int // 长度\n        cap   int // 容量\n}\n```",
      "source": "data/questions/go_interview/go_interview.md#go-005"
    },
    {
      "id": "go-006",
      "type": "basic",
      "topic": "基础面试题",
      "text": "使用for range 的时候，它的地址会发生变化吗？",
      "answer": "在Go1.22之前，对于 `for range` 循环中的迭代变量，其内存地址是不会发生变化的。但是，Go1.22之后的地址是临时的，是变化的，不一样的，不再是共享内存了\n\n**分析：**\n\nGo1.22之前：\n\n```go\nfor index, value := range collection {\n    // ...\n}\n```\n\n这里 `value` 是一个**副本**。在每次迭代中，`collection` 中的当前元素值会被**复制**到 `value` 这个变量中。Go 编译器通常会为 `value` 分配一块固定的内存地址，然后在每次迭代时，将当前元素的值覆盖到这块内存中。所以，当你打印 `\u0026value` 时，你会发现它的内存地址在整个循环过程中都是保持不变的。\n\n但是在Go1.23及以后，使用 `for range` 遍历一个集合时，**迭代变量的地址会发生变化**。这是因为 `for range` 每次迭代时都会重新生成迭代变量（如 `value`），这些变量在内存中是不同的地址",
      "source": "data/questions/go_interview/go_interview.md#go-006"
    },
    {
      "id": "go-007",
      "type": "basic",
      "topic": "基础面试题",
      "text": "如何高效地拼接字符串？",
      "answer": "拼接字符串的方式有：`+` , `fmt.Sprintf` , [`strings.Builder`](https://zhida.zhihu.com/search?content_id=192906787\\\u0026content_type=Article\\\u0026match_order=1\\\u0026q=strings.Builder\\\u0026zhida_source=entity), [`bytes.Buffer`](https://zhida.zhihu.com/search?content_id=192906787\\\u0026content_type=Article\\\u0026match_order=1\\\u0026q=bytes.Buffer\\\u0026zhida_source=entity), `strings.Join`\n\n1.  \"+\"\n\n使用`+`操作符进行拼接时，会对字符串进行遍历，计算并开辟一个新的空间来存储原来的两个字符串。\n\n2.  fmt.Sprintf\n\n由于采用了接口参数，必须要用反射获取值，因此有性能损耗。\n\n3. strings.Builder：\n\n用WriteString()进行拼接，内部实现是指针+切片，同时String()返回拼接后的字符串，它是直接把[]byte转换为string，从而避免变量拷贝。\n\n4. bytes.Buffer\n\n`bytes.Buffer`是一个一个缓冲`byte`类型的缓冲器，这个缓冲器里存放着都是`byte`，\n\n`bytes.buffer`底层也是一个`[]byte`切片。\n\n5.  strings.join\n\n`strings.join`也是基于`strings.builder`来实现的,并且可以自定义分隔符，在join方法内调用了b.Grow(n)方法，这个是进行初步的容量分配，而前面计算的n的长度就是我们要拼接的slice的长度，因为我们传入切片长度固定，所以提前进行容量分配可以减少内存分配，很高效。\n\n**性能比较：**\n\nstrings.Join ≈ strings.Builder \u003e bytes.Buffer \u003e \"+\" \u003e fmt.Sprintf\n\n5种拼接方法的实例代码\n\n```go\nfunc main(){\n        a := []string{\"a\", \"b\", \"c\"}\n        //方式1：+\n        ret := a[0] + a[1] + a[2]\n        //方式2：fmt.Sprintf\n        ret := fmt.Sprintf(\"%s%s%s\", a[0],a[1],a[2])\n        //方式3：strings.Builder\n        var sb strings.Builder\n        sb.WriteString(a[0])\n        sb.WriteString(a[1])\n        sb.WriteString(a[2])\n        ret := sb.String()\n        //方式4：bytes.Buffer\n        buf := new(bytes.Buffer)\n        buf.Write(a[0])\n        buf.Write(a[1])\n        buf.Write(a[2])\n        ret := buf.String()\n        //方式5：strings.Join\n        ret := strings.Join(a,\"\")\n}\n```",
      "source": "data/questions/go_interview/go_interview.md#go-007"
    },
    {
      "id": "go-008",
      "type": "basic",
      "topic": "基础面试题",
      "text": "defer 的执行顺序是怎样的？defer 的作用或者使用场景是什么?",
      "answer": "defer执行顺序和调用顺序相反，类似于栈后进先出(LIFO)\n\ndefer 的作用是：当 defer 语句被执行时，跟在 defer 后面的函数会被延迟执行。直到 包含该 defer 语句的函数执行完毕时，defer 后的函数才会被执行，不论包含 defer 语句的函数是通过 return 正常结束，还是由于 panic 导致的异常结束。 你可以在一个函数中执行多条 defer 语句，它们的执行顺序与声明顺序相反。\n\ndefer 的常用场景:\n\n* defer语句经常被用于处理成对的操作，如打开、关闭、连接、断开连接、 加锁、释放锁。\n\n* 通过defer机制，不论函数逻辑多复杂，都能保证在任何执行路径下，资 源被释放。\n\n* 释放资源的defer应该直接跟在请求资源的语句后。\n\n**分析：**\n\n```go\nfunc test() int {\n        i := 0\n        defer func() {\n                fmt.Println(\"defer1\")\n        }()\n        defer func() {\n                i += 1\n                fmt.Println(\"defer2\")\n        }()\n        return i\n}\n\nfunc main() {\n        fmt.Println(\"return\", test())\n}\n\n// 输出：\n// defer2\n// defer1\n// return 0\n```\n\n上面这个例子中，test返回值并没有修改，这是由于Go的返回机制决定的，执行Return语句后，Go会创建一个临时变量保存返回值。如果是有名返回（也就是指明返回值`func test() (i int)`）\n\n```go\nfunc test() (i int) {\n        i = 0\n        defer func() {\n                i += 1\n                fmt.Println(\"defer2\")\n        }()\n        return i\n}\n\nfunc main() {\n        fmt.Println(\"return\", test())\n}\n// 输出：\n// defer2\n// return 1\n\n```\n\n这个例子中，返回值被修改了。对于有名返回值的函数，执行 return 语句时，并不会再创建临时变量保存，因此，defer 语句修改了 i，即对返回值产生了影响。",
      "source": "data/questions/go_interview/go_interview.md#go-008"
    },
    {
      "id": "go-009",
      "type": "basic",
      "topic": "基础面试题",
      "text": "什么是 rune 类型？",
      "answer": "Go 语言的字符有以下两种：\n\n* uint8 类型，或者叫 byte 型，代表了 ASCII 码的一个字符。\n\n* rune 类型，代表一个 UTF-8 字符，当需要处理中文、日文或者其他复合字符时，则需要用到 rune 类型。rune 类型等价于 int32 类型。\n\n```go\npackage main\nimport \"fmt\"\n\nfunc main() {\n    var str = \"hello 你好\" //思考下 len(str) 的长度是多少？\n\n    //golang中string底层是通过byte数组实现的，直接求len 实际是在按字节长度计算\n    //所以一个汉字占3个字节算了3个长度\n    fmt.Println(\"len(str):\", len(str))  // len(str): 12\n\n    //通过rune类型处理unicode字符\n    fmt.Println(\"rune:\", len([]rune(str))) //rune: 8\n}\n```",
      "source": "data/questions/go_interview/go_interview.md#go-009"
    },
    {
      "id": "go-010",
      "type": "basic",
      "topic": "基础面试题",
      "text": "Go 语言 tag 有什么用？",
      "answer": "tag可以为结构体成员提供属性。常见的：\n\n1. json序列化或反序列化时字段的名称\n\n2. db: sqlx模块中对应的数据库字段名\n\n3. form: gin框架中对应的前端的数据字段名\n\n4. binding: 搭配 form 使用, 默认如果没查找到结构体中的某个字段则不报错值为空, binding为 required 代表没找到返回错误给前端",
      "source": "data/questions/go_interview/go_interview.md#go-010"
    },
    {
      "id": "go-011",
      "type": "basic",
      "topic": "基础面试题",
      "text": "go 打印时 %v %+v %#v 的区别？",
      "answer": "* %v 只输出所有的值；\n\n* %+v 先输出字段名字，再输出该字段的值；\n\n* %#v 先输出结构体名字值，再输出结构体（字段名字+字段的值）；\n\n```go\npackage main\nimport \"fmt\"\n\ntype student struct {\n  id   int32\n  name string\n}\n\nfunc main() {\n  a := \u0026student{id: 1, name: \"微客鸟窝\"}\n\n  fmt.Printf(\"a=%v  \\n\", a) // a=\u0026{1 微客鸟窝}\n  fmt.Printf(\"a=%+v  \\n\", a) // a=\u0026{id:1 name:微客鸟窝}\n  fmt.Printf(\"a=%#v  \\n\", a) // a=\u0026main.student{id:1, name:\"微客鸟窝\"}\n}\n```",
      "source": "data/questions/go_interview/go_interview.md#go-011"
    },
    {
      "id": "go-012",
      "type": "basic",
      "topic": "基础面试题",
      "text": "Go语言中空 struct{} 占用空间么？",
      "answer": "可以使用 unsafe.Sizeof 计算出一个数据类型实例需要占用的字节数，空struct{}不占用任何空间\n\n```go\npackage main\n\nimport (\n  \"fmt\"\n  \"unsafe\"\n)\n\nfunc main() {\n  fmt.Println(unsafe.Sizeof(struct{}{}))  //0\n}\n```",
      "source": "data/questions/go_interview/go_interview.md#go-012"
    },
    {
      "id": "go-013",
      "type": "basic",
      "topic": "基础面试题",
      "text": "Go语言中，空 struct{} 有什么用？",
      "answer": "* 用map模拟一个set，那么就要把值置为struct{}，struct{}本身不占任何空间，可以避免任何多余的内存分配。\n\n```go\ntype Set map[string]struct{}\n\nfunc main() {\n        set := make(Set)\n\n        for _, item := range []string{\"A\", \"A\", \"B\", \"C\"} {\n                set[item] = struct{}{}\n        }\n        fmt.Println(len(set)) // 3\n        if _, ok := set[\"A\"]; ok {\n                fmt.Println(\"A exists\") // A exists\n        }\n}\n```\n\n* 有时候给通道发送一个空结构体,channel\u003c-struct{}{}，可以节省空间\n\n```go\nfunc main() {\n        ch := make(chan struct{}, 1)\n        go func() {\n                \u003c-ch\n                // do something\n        }()\n        ch \u003c- struct{}{}\n        // ...\n}\n```\n\n* 表示仅有方法的结构体\n\n```go\ntype Lamp struct{}\n```",
      "source": "data/questions/go_interview/go_interview.md#go-013"
    },
    {
      "id": "go-014",
      "type": "basic",
      "topic": "基础面试题",